{
    "formatVersion": 1,
    "hostUniformCatalogVersion": 1,
    "name": "Basics / Warm tint",
    "pipelineKind": "raster",
    "language": "hlsl",
    "stages": [
        {
            "stage": "vertex",
            "entryPoint": "VSMain",
            "source": "struct VSOut {\n    float4 pos : SV_POSITION;\n};\n\nVSOut VSMain(uint vid : SV_VertexID)\n{\n    VSOut o;\n    float2 tri[3] = {\n        float2(0.0f, -0.5f),\n        float2(0.5f, 0.5f),\n        float2(-0.5f, 0.5f)\n    };\n    o.pos = float4(tri[vid], 0.0f, 1.0f);\n    return o;\n}"
        },
        {
            "stage": "fragment",
            "entryPoint": "PSMain",
            "source": "cbuffer Host : register(b0)\n{\n    float time_sim_ms;\n    float time_wall_ms;\n    float delta_time_ms;\n    uint  frame_index;\n    float resolution_x;\n    float resolution_y;\n    float mouse_x;\n    float mouse_y;\n    uint  mouse_buttons;\n    float scroll_delta_x;\n    float scroll_delta_y;\n    float drag_accum_x;\n    float drag_accum_y;\n    float scroll_accum_x;\n    float scroll_accum_y;\n    float pan_accum_x;\n    float pan_accum_y;\n};\nstruct VSOut { float4 pos : SV_POSITION; };\nfloat4 PSMain(VSOut i) : SV_Target\n{\n    float2 p = i.pos.xy / float2(resolution_x, resolution_y);\n    p.y = 1.0f - p.y;\n    return float4(p.x, p.y * 0.7f + 0.2f, 0.15f, 1.0f);\n}"
        }
    ]
}
