{
    "formatVersion": 1,
    "hostUniformCatalogVersion": 1,
    "name": "Tessellation / PN-Triangles",
    "pipelineKind": "raster",
    "language": "hlsl",
    "stages": [
        {
            "stage": "vertex",
            "entryPoint": "VSMain",
            "source": "// Requires: mesh OBJ (File \u2192 Open Mesh OBJ)\n// Vertex layout: position (float3), normal (float3), UV (float2)\n\nstruct VSInput\n{\n    float3 pos    : POSITION;\n    float3 normal : NORMAL;\n    float2 uv     : TEXCOORD0;\n};\n\nstruct VSOutput\n{\n    float3 worldPos : WORLDPOS;\n    float3 normal   : NORMAL;\n    float2 uv       : TEXCOORD0;\n};\n\nVSOutput VSMain(VSInput input)\n{\n    VSOutput o;\n    o.worldPos = input.pos;\n    o.normal = normalize(input.normal);\n    o.uv = input.uv;\n    return o;\n}\n"
        },
        {
            "stage": "tessellation_control",
            "entryPoint": "HSMain",
            "source": "cbuffer Host : register(b0)\n{\n    float time_sim_ms;\n    float time_wall_ms;\n    float delta_time_ms;\n    uint  frame_index;\n    float resolution_x;\n    float resolution_y;\n    float mouse_x;\n    float mouse_y;\n    uint  mouse_buttons;\n    float scroll_delta_x;\n    float scroll_delta_y;\n    float drag_accum_x;\n    float drag_accum_y;\n    float scroll_accum_x;\n    float scroll_accum_y;\n    float pan_accum_x;\n    float pan_accum_y;\n};\n\nstruct VSOutput\n{\n    float3 worldPos : WORLDPOS;\n    float3 normal   : NORMAL;\n    float2 uv       : TEXCOORD0;\n};\n\nstruct HSOutput\n{\n    float3 worldPos : WORLDPOS;\n    float3 normal   : NORMAL;\n    float2 uv       : TEXCOORD0;\n};\n\nstruct HSConstOutput\n{\n    float edges[3]  : SV_TessFactor;\n    float inside    : SV_InsideTessFactor;\n    float3 b210 : B210;\n    float3 b120 : B120;\n    float3 b021 : B021;\n    float3 b012 : B012;\n    float3 b102 : B102;\n    float3 b201 : B201;\n    float3 b111 : B111;\n};\n\nfloat3 projectOntoPlane(float3 pt, float3 planePos, float3 planeNormal)\n{\n    return pt - dot(pt - planePos, planeNormal) * planeNormal;\n}\n\nHSConstOutput PatchConstFunc(InputPatch<VSOutput, 3> patch, uint patchID : SV_PrimitiveID)\n{\n    HSConstOutput o;\n    float tess = 6.0;\n    o.edges[0] = tess;\n    o.edges[1] = tess;\n    o.edges[2] = tess;\n    o.inside = tess;\n\n    float3 p0 = patch[0].worldPos;\n    float3 p1 = patch[1].worldPos;\n    float3 p2 = patch[2].worldPos;\n    float3 n0 = patch[0].normal;\n    float3 n1 = patch[1].normal;\n    float3 n2 = patch[2].normal;\n\n    o.b210 = (2.0 * p0 + p1 - dot(p1 - p0, n0) * n0) / 3.0;\n    o.b120 = (2.0 * p1 + p0 - dot(p0 - p1, n1) * n1) / 3.0;\n    o.b021 = (2.0 * p1 + p2 - dot(p2 - p1, n1) * n1) / 3.0;\n    o.b012 = (2.0 * p2 + p1 - dot(p1 - p2, n2) * n2) / 3.0;\n    o.b102 = (2.0 * p2 + p0 - dot(p0 - p2, n2) * n2) / 3.0;\n    o.b201 = (2.0 * p0 + p2 - dot(p2 - p0, n0) * n0) / 3.0;\n    float3 center = (p0 + p1 + p2) / 3.0;\n    float3 avg = (o.b210 + o.b120 + o.b021 + o.b012 + o.b102 + o.b201) / 6.0;\n    o.b111 = avg + (avg - center) * 0.5;\n\n    return o;\n}\n\n[domain(\"tri\")]\n[partitioning(\"fractional_odd\")]\n[outputtopology(\"triangle_cw\")]\n[outputcontrolpoints(3)]\n[patchconstantfunc(\"PatchConstFunc\")]\nHSOutput HSMain(InputPatch<VSOutput, 3> patch, uint cpID : SV_OutputControlPointID)\n{\n    HSOutput o;\n    o.worldPos = patch[cpID].worldPos;\n    o.normal = patch[cpID].normal;\n    o.uv = patch[cpID].uv;\n    return o;\n}\n"
        },
        {
            "stage": "tessellation_evaluation",
            "entryPoint": "DSMain",
            "source": "cbuffer Host : register(b0)\n{\n    float time_sim_ms;\n    float time_wall_ms;\n    float delta_time_ms;\n    uint  frame_index;\n    float resolution_x;\n    float resolution_y;\n    float mouse_x;\n    float mouse_y;\n    uint  mouse_buttons;\n    float scroll_delta_x;\n    float scroll_delta_y;\n    float drag_accum_x;\n    float drag_accum_y;\n    float scroll_accum_x;\n    float scroll_accum_y;\n    float pan_accum_x;\n    float pan_accum_y;\n};\n\nstruct HSOutput\n{\n    float3 worldPos : WORLDPOS;\n    float3 normal   : NORMAL;\n    float2 uv       : TEXCOORD0;\n};\n\nstruct HSConstOutput\n{\n    float edges[3]  : SV_TessFactor;\n    float inside    : SV_InsideTessFactor;\n    float3 b210 : B210;\n    float3 b120 : B120;\n    float3 b021 : B021;\n    float3 b012 : B012;\n    float3 b102 : B102;\n    float3 b201 : B201;\n    float3 b111 : B111;\n};\n\nstruct DSOutput\n{\n    float4 pos    : SV_POSITION;\n    float3 normal : NORMAL;\n    float2 uv     : TEXCOORD0;\n};\n\nfloat4x4 lookAtRH(float3 eye, float3 target, float3 up)\n{\n    float3 f = normalize(target - eye);\n    float3 r = normalize(cross(f, up));\n    float3 u = cross(r, f);\n    return float4x4(\n        r.x, u.x, -f.x, 0,\n        r.y, u.y, -f.y, 0,\n        r.z, u.z, -f.z, 0,\n        -dot(r,eye), -dot(u,eye), dot(f,eye), 1);\n}\n\nfloat4x4 perspectiveRH(float fovY, float aspect, float zn, float zf)\n{\n    float h = 1.0 / tan(fovY * 0.5);\n    float w = h / aspect;\n    float a = zf / (zn - zf);\n    float b = zn * a;\n    return float4x4(\n        w, 0, 0, 0,\n        0, h, 0, 0,\n        0, 0, a, -1,\n        0, 0, b, 0);\n}\n\n[domain(\"tri\")]\nDSOutput DSMain(HSConstOutput patchConst, float3 bary : SV_DomainLocation,\n                const OutputPatch<HSOutput, 3> patch)\n{\n    DSOutput o;\n\n    float u = bary.x;\n    float v = bary.y;\n    float w = bary.z;\n\n    float3 p0 = patch[0].worldPos;\n    float3 p1 = patch[1].worldPos;\n    float3 p2 = patch[2].worldPos;\n\n    float3 pos = p0 * u*u*u + p1 * v*v*v + p2 * w*w*w\n        + patchConst.b210 * 3.0*u*u*v + patchConst.b120 * 3.0*u*v*v\n        + patchConst.b021 * 3.0*v*v*w + patchConst.b012 * 3.0*v*w*w\n        + patchConst.b102 * 3.0*w*w*u + patchConst.b201 * 3.0*w*u*u\n        + patchConst.b111 * 6.0*u*v*w;\n\n    float3 normal = normalize(u * patch[0].normal + v * patch[1].normal + w * patch[2].normal);\n    float2 uv = u * patch[0].uv + v * patch[1].uv + w * patch[2].uv;\n\n    float aspect = resolution_x / resolution_y;\n    float angle = drag_accum_x * 0.01;\n    float elevation = clamp(-drag_accum_y * 0.01, -1.4, 1.4);\n    float dist = max(0.5, 3.0 - scroll_accum_y * 0.3);\n    float3 fwd = float3(sin(angle)*cos(elevation), sin(elevation), cos(angle)*cos(elevation));\n    float3 right = normalize(cross(float3(0,1,0), fwd));\n    float3 camUp = cross(fwd, right);\n    float panScale = dist * 0.002;\n    float3 panOff = right * (-pan_accum_x * panScale) + camUp * (pan_accum_y * panScale);\n    float3 eye = panOff + float3(cos(angle)*cos(elevation)*dist, sin(elevation)*dist, sin(angle)*cos(elevation)*dist);\n    float4x4 view = lookAtRH(eye, panOff, float3(0,1,0));\n    float4x4 proj = perspectiveRH(1.0, aspect, 0.1, 100.0);\n\n    o.pos = mul(proj, mul(view, float4(pos, 1.0)));\n    o.normal = normal;\n    o.uv = uv;\n    return o;\n}\n"
        },
        {
            "stage": "fragment",
            "entryPoint": "PSMain",
            "source": "struct DSOutput\n{\n    float4 pos    : SV_POSITION;\n    float3 normal : NORMAL;\n    float2 uv     : TEXCOORD0;\n};\n\nfloat4 PSMain(DSOutput input) : SV_Target\n{\n    float3 n = normalize(input.normal);\n    float3 lightDir = normalize(float3(1.0, 1.0, 0.5));\n    float diff = saturate(dot(n, lightDir));\n    float3 color = float3(0.9, 0.5, 0.2) * (diff * 0.8 + 0.2);\n    return float4(color, 1.0);\n}\n"
        }
    ]
}
