{
    "formatVersion": 1,
    "hostUniformCatalogVersion": 1,
    "name": "Textures / Textured quad",
    "pipelineKind": "raster",
    "language": "hlsl",
    "stages": [
        {
            "stage": "vertex",
            "entryPoint": "VSMain",
            "source": "struct VSOut {\n    float4 pos : SV_POSITION;\n    [[vk::location(0)]] float2 uv : TEXCOORD0;\n};\n\nVSOut VSMain(uint vid : SV_VertexID)\n{\n    VSOut o;\n    o.uv = float2((vid << 1) & 2, vid & 2);\n    o.pos = float4(o.uv * 2.0f - 1.0f, 0.0f, 1.0f);\n    o.uv.y = 1.0f - o.uv.y;\n    return o;\n}"
        },
        {
            "stage": "fragment",
            "entryPoint": "PSMain",
            "source": "// Requires: texture image (add via Textures panel)\n// Binds as combined image sampler: [[vk::combinedImageSampler]] [[vk::binding(0, 1)]]\n\ncbuffer Host : register(b0)\n{\n    float time_sim_ms;\n    float time_wall_ms;\n    float delta_time_ms;\n    uint  frame_index;\n    float resolution_x;\n    float resolution_y;\n    float mouse_x;\n    float mouse_y;\n    uint  mouse_buttons;\n    float scroll_delta_x;\n    float scroll_delta_y;\n    float drag_accum_x;\n    float drag_accum_y;\n    float scroll_accum_x;\n    float scroll_accum_y;\n    float pan_accum_x;\n    float pan_accum_y;\n};\n\n[[vk::combinedImageSampler]] [[vk::binding(0, 1)]]\nTexture2D tex0 : register(t0);\n[[vk::combinedImageSampler]] [[vk::binding(0, 1)]]\nSamplerState samp0 : register(s0);\n\nstruct VSOut {\n    float4 pos : SV_POSITION;\n    [[vk::location(0)]] float2 uv : TEXCOORD0;\n};\n\nfloat4 PSMain(VSOut i) : SV_Target\n{\n    float4 col = tex0.Sample(samp0, i.uv);\n    return col;\n}"
        }
    ]
}
