{
    "formatVersion": 1,
    "hostUniformCatalogVersion": 1,
    "name": "RT / Shadows",
    "pipelineKind": "raytrace",
    "language": "hlsl",
    "maxPipelineRayRecursionDepth": 2,
    "stages": [
        {
            "stage": "raygen",
            "entryPoint": "RayGen",
            "source": "[[vk::binding(0, 0)]] RWTexture2D<float4> gOutput;\n[[vk::binding(1, 0)]] cbuffer Host {\n    float time_sim_ms;\n    float time_wall_ms;\n    float delta_time_ms;\n    uint  frame_index;\n    float resolution_x;\n    float resolution_y;\n    float mouse_x;\n    float mouse_y;\n    uint  mouse_buttons;\n    float scroll_delta_x;\n    float scroll_delta_y;\n    float drag_accum_x;\n    float drag_accum_y;\n    float scroll_accum_x;\n    float scroll_accum_y;\n    float pan_accum_x;\n    float pan_accum_y;\n};\n[[vk::binding(2, 0)]] RaytracingAccelerationStructure gScene;\n\nstruct Payload { float4 c; };\n\n[shader(\"raygeneration\")]\nvoid RayGen()\n{\n    uint2 idx = DispatchRaysIndex().xy;\n    uint2 dim = DispatchRaysDimensions().xy;\n    float2 uv = (float2(idx) + 0.5) / float2(dim);\n    float2 ndc = uv * 2.0 - 1.0;\n    ndc.y = -ndc.y;\n    float aspect = float(dim.x) / float(dim.y);\n    float3 dir = normalize(float3(ndc.x * aspect, ndc.y, 2.0));\n\n    RayDesc ray;\n    ray.Origin = float3(0, 1, -4);\n    ray.TMin = 0.001;\n    ray.Direction = dir;\n    ray.TMax = 100.0;\n\n    Payload p;\n    p.c = float4(0, 0, 0, 1);\n    TraceRay(gScene, RAY_FLAG_NONE, 0xFF, 0, 0, 0, ray, p);\n    gOutput[idx] = p.c;\n}\n"
        },
        {
            "stage": "miss",
            "entryPoint": "Miss",
            "source": "struct Payload { float4 c; };\n[shader(\"miss\")]\nvoid Miss(inout Payload p)\n{\n    float3 dir = WorldRayDirection();\n    float sky = saturate(0.5 + 0.5 * dir.y);\n    p.c = float4(lerp(float3(0.6, 0.8, 1.0), float3(0.2, 0.4, 0.9), sky), 1.0);\n}\n"
        },
        {
            "stage": "miss",
            "entryPoint": "ShadowMiss",
            "source": "struct ShadowPayload { float shadow; };\n[shader(\"miss\")]\nvoid ShadowMiss(inout ShadowPayload p)\n{\n    p.shadow = 1.0;\n}\n"
        },
        {
            "stage": "closest_hit",
            "entryPoint": "ClosestHit",
            "source": "[[vk::binding(1, 0)]] cbuffer Host {\n    float time_sim_ms;\n    float time_wall_ms;\n    float delta_time_ms;\n    uint  frame_index;\n    float resolution_x;\n    float resolution_y;\n    float mouse_x;\n    float mouse_y;\n    uint  mouse_buttons;\n    float scroll_delta_x;\n    float scroll_delta_y;\n    float drag_accum_x;\n    float drag_accum_y;\n    float scroll_accum_x;\n    float scroll_accum_y;\n    float pan_accum_x;\n    float pan_accum_y;\n};\n[[vk::binding(2, 0)]] RaytracingAccelerationStructure gScene;\n\nstruct Payload { float4 c; };\nstruct ShadowPayload { float shadow; };\n\n[shader(\"closesthit\")]\nvoid ClosestHit(inout Payload p, in BuiltInTriangleIntersectionAttributes a)\n{\n    float t = time_sim_ms * 0.001;\n    float3 hitPos = WorldRayOrigin() + WorldRayDirection() * RayTCurrent();\n    float3 normal = normalize(float3(0, 1, 0));\n    float3 lightPos = float3(sin(t) * 3.0, 4.0, cos(t) * 3.0);\n    float3 lightDir = normalize(lightPos - hitPos);\n    RayDesc shadowRay;\n    shadowRay.Origin = hitPos + normal * 0.01;\n    shadowRay.TMin = 0.001;\n    shadowRay.Direction = lightDir;\n    shadowRay.TMax = length(lightPos - hitPos);\n    ShadowPayload sp;\n    sp.shadow = 0.0;\n    TraceRay(gScene, RAY_FLAG_ACCEPT_FIRST_HIT_AND_END_SEARCH, 0xFF, 0, 0, 1, shadowRay, sp);\n    float diff = max(dot(normal, lightDir), 0.0);\n    float3 baseColor = float3(0.7, 0.7, 0.7);\n    float3 col = baseColor * (0.2 + 0.8 * diff * sp.shadow);\n    p.c = float4(col, 1.0);\n}\n"
        }
    ]
}
