{
    "formatVersion": 1,
    "hostUniformCatalogVersion": 1,
    "name": "Patterns / Mandelbrot fractal",
    "pipelineKind": "raster",
    "language": "hlsl",
    "stages": [
        {
            "stage": "vertex",
            "entryPoint": "VSMain",
            "source": "struct VSOut {\n    float4 pos : SV_POSITION;\n    [[vk::location(0)]] float2 uv : TEXCOORD0;\n};\n\nVSOut VSMain(uint vid : SV_VertexID)\n{\n    VSOut o;\n    o.uv = float2((vid << 1) & 2, vid & 2);\n    o.pos = float4(o.uv * 2.0f - 1.0f, 0.0f, 1.0f);\n    o.uv.y = 1.0f - o.uv.y;\n    return o;\n}"
        },
        {
            "stage": "fragment",
            "entryPoint": "PSMain",
            "source": "cbuffer Host : register(b0)\n{\n    float time_sim_ms;\n    float time_wall_ms;\n    float delta_time_ms;\n    uint  frame_index;\n    float resolution_x;\n    float resolution_y;\n    float mouse_x;\n    float mouse_y;\n    uint  mouse_buttons;\n    float scroll_delta_x;\n    float scroll_delta_y;\n    float drag_accum_x;\n    float drag_accum_y;\n    float scroll_accum_x;\n    float scroll_accum_y;\n    float pan_accum_x;\n    float pan_accum_y;\n};\n\nstruct VSOut {\n    float4 pos : SV_POSITION;\n    [[vk::location(0)]] float2 uv : TEXCOORD0;\n};\n\nfloat4 PSMain(VSOut i) : SV_Target\n{\n    float2 mouse = float2(mouse_x / max(1.0, resolution_x), mouse_y / max(1.0, resolution_y));\n    float zoom = 2.5 - mouse.y * 2.0;\n    float2 center = float2(-0.5 + (mouse.x - 0.5) * 1.0, (mouse.y - 0.5) * 0.5);\n    float2 uv = (i.uv - 0.5) * zoom + center;\n    float aspect = resolution_x / max(1.0, resolution_y);\n    uv.x *= aspect;\n    float2 z = float2(0.0, 0.0);\n    float2 c = uv;\n    int maxIter = 128;\n    int iter = 0;\n    for (int k = 0; k < maxIter; k++) {\n        float x2 = z.x * z.x - z.y * z.y + c.x;\n        float y2 = 2.0 * z.x * z.y + c.y;\n        z = float2(x2, y2);\n        if (dot(z, z) > 4.0) break;\n        iter++;\n    }\n    if (iter >= maxIter) return float4(0, 0, 0, 1);\n    float t = (float)iter / (float)maxIter;\n    float3 col;\n    col.r = 0.5 + 0.5 * cos(3.0 + t * 15.0);\n    col.g = 0.5 + 0.5 * cos(3.0 + t * 15.0 + 0.6);\n    col.b = 0.5 + 0.5 * cos(3.0 + t * 15.0 + 1.0);\n    return float4(col, 1.0);\n}"
        }
    ]
}
