{
    "formatVersion": 1,
    "hostUniformCatalogVersion": 1,
    "name": "Compute / Fluid Simulation",
    "pipelineKind": "compute",
    "language": "hlsl",
    "stages": [
        {
            "stage": "compute",
            "entryPoint": "CSMain",
            "source": "cbuffer Host : register(b0)\n{\n    float time_sim_ms;\n    float time_wall_ms;\n    float delta_time_ms;\n    uint  frame_index;\n    float resolution_x;\n    float resolution_y;\n    float mouse_x;\n    float mouse_y;\n    uint  mouse_buttons;\n    float scroll_delta_x;\n    float scroll_delta_y;\n    float drag_accum_x;\n    float drag_accum_y;\n    float scroll_accum_x;\n    float scroll_accum_y;\n    float pan_accum_x;\n    float pan_accum_y;\n};\n\nRWTexture2D<float4> output : register(u0);\n\nfloat2 hash2(float2 p)\n{\n    p = float2(dot(p, float2(127.1, 311.7)), dot(p, float2(269.5, 183.3)));\n    return -1.0 + 2.0 * frac(sin(p) * 43758.5453);\n}\n\nfloat noise(float2 p)\n{\n    float2 i = floor(p);\n    float2 f = frac(p);\n    float2 u = f * f * (3.0 - 2.0 * f);\n    return lerp(lerp(dot(hash2(i + float2(0, 0)), f - float2(0, 0)),\n                     dot(hash2(i + float2(1, 0)), f - float2(1, 0)), u.x),\n                lerp(dot(hash2(i + float2(0, 1)), f - float2(0, 1)),\n                     dot(hash2(i + float2(1, 1)), f - float2(1, 1)), u.x), u.y);\n}\n\n[numthreads(8, 8, 1)]\nvoid CSMain(uint3 dtid : SV_DispatchThreadID)\n{\n    uint2 dim;\n    output.GetDimensions(dim.x, dim.y);\n    if (dtid.x >= dim.x || dtid.y >= dim.y)\n        return;\n\n    float2 uv = float2(dtid.xy) / float2(dim);\n    float t = time_sim_ms * 0.001;\n\n    float2 vel = float2(0, 0);\n    vel.x = noise(uv * 4.0 + float2(0, t * 0.5)) * 0.5;\n    vel.y = noise(uv * 4.0 + float2(t * 0.3, 100)) * 0.5;\n\n    if (mouse_buttons & 1) {\n        float2 mouseUV = float2(mouse_x, mouse_y) / float2(resolution_x, resolution_y);\n        float2 diff = uv - mouseUV;\n        float dist = length(diff);\n        if (dist < 0.15) {\n            float strength = 1.0 - dist / 0.15;\n            vel += normalize(float2(-diff.y, diff.x)) * strength * 2.0;\n        }\n    }\n\n    float n1 = noise(uv * 8.0 + vel * t);\n    float n2 = noise(uv * 16.0 - vel * t * 0.5 + 50.0);\n    float density = saturate(0.5 + 0.5 * (n1 + n2 * 0.5));\n\n    float speed = length(vel);\n    float3 color;\n    color.r = saturate(density * 0.3 + speed * 0.5);\n    color.g = saturate(density * 0.6 + speed * 0.2);\n    color.b = saturate(density * 1.0);\n\n    output[dtid.xy] = float4(color, 1.0);\n}\n"
        }
    ]
}
