{
    "formatVersion": 1,
    "hostUniformCatalogVersion": 1,
    "name": "Patterns / Truchet tiles",
    "pipelineKind": "raster",
    "language": "hlsl",
    "stages": [
        {
            "stage": "vertex",
            "entryPoint": "VSMain",
            "source": "struct VSOut {\n    float4 pos : SV_POSITION;\n    [[vk::location(0)]] float2 uv : TEXCOORD0;\n};\n\nVSOut VSMain(uint vid : SV_VertexID)\n{\n    VSOut o;\n    o.uv = float2((vid << 1) & 2, vid & 2);\n    o.pos = float4(o.uv * 2.0f - 1.0f, 0.0f, 1.0f);\n    o.uv.y = 1.0f - o.uv.y;\n    return o;\n}"
        },
        {
            "stage": "fragment",
            "entryPoint": "PSMain",
            "source": "cbuffer Host : register(b0)\n{\n    float time_sim_ms;\n    float time_wall_ms;\n    float delta_time_ms;\n    uint  frame_index;\n    float resolution_x;\n    float resolution_y;\n    float mouse_x;\n    float mouse_y;\n    uint  mouse_buttons;\n    float scroll_delta_x;\n    float scroll_delta_y;\n    float drag_accum_x;\n    float drag_accum_y;\n    float scroll_accum_x;\n    float scroll_accum_y;\n    float pan_accum_x;\n    float pan_accum_y;\n};\n\nstruct VSOut {\n    float4 pos : SV_POSITION;\n    [[vk::location(0)]] float2 uv : TEXCOORD0;\n};\n\nfloat hash21(float2 p)\n{\n    return frac(sin(dot(p, float2(41.1, 289.7))) * 45758.5453);\n}\n\nfloat4 PSMain(VSOut i) : SV_Target\n{\n    float t = time_sim_ms * 0.0005;\n    float scale = 10.0;\n    float2 uv = i.uv * scale;\n    float2 id = floor(uv);\n    float2 gv = frac(uv);\n    float rnd = hash21(id + floor(t) * 0.01);\n    if (rnd > 0.5) gv.x = 1.0 - gv.x;\n    float d1 = length(gv - float2(0, 0)) - 0.5;\n    float d2 = length(gv - float2(1, 1)) - 0.5;\n    float d = min(abs(d1), abs(d2));\n    float lineWidth = 0.08;\n    float line = smoothstep(lineWidth, lineWidth - 0.02, d);\n    float3 bg = float3(0.95, 0.92, 0.88);\n    float3 fg = 0.5 + 0.5 * sin(float3(0, 2, 4) + id.x * 0.5 + id.y * 0.3 + t * 2.0);\n    float3 col = lerp(bg, fg, line);\n    return float4(col, 1.0);\n}"
        }
    ]
}
