{
    "formatVersion": 1,
    "hostUniformCatalogVersion": 1,
    "name": "Blending / Additive Glow",
    "pipelineKind": "raster",
    "blend": "additive",
    "language": "hlsl",
    "stages": [
        {
            "stage": "vertex",
            "entryPoint": "VSMain",
            "source": "struct VSOut\n{\n    float4 pos : SV_POSITION;\n    float2 uv  : TEXCOORD0;\n};\n\nVSOut VSMain(uint vid : SV_VertexID)\n{\n    VSOut o;\n    float2 uv = float2((vid << 1) & 2, vid & 2);\n    o.pos = float4(uv * 2.0 - 1.0, 0.0, 1.0);\n    o.uv = uv;\n    o.uv.y = 1.0 - o.uv.y;\n    return o;\n}\n"
        },
        {
            "stage": "fragment",
            "entryPoint": "PSMain",
            "source": "cbuffer Host : register(b0)\n{\n    float time_sim_ms;\n    float time_wall_ms;\n    float delta_time_ms;\n    uint  frame_index;\n    float resolution_x;\n    float resolution_y;\n    float mouse_x;\n    float mouse_y;\n    uint  mouse_buttons;\n    float scroll_delta_x;\n    float scroll_delta_y;\n    float drag_accum_x;\n    float drag_accum_y;\n    float scroll_accum_x;\n    float scroll_accum_y;\n    float pan_accum_x;\n    float pan_accum_y;\n};\n\nstruct VSOut\n{\n    float4 pos : SV_POSITION;\n    float2 uv  : TEXCOORD0;\n};\n\nfloat4 PSMain(VSOut i) : SV_Target\n{\n    float2 uv = i.uv;\n    float t = time_sim_ms * 0.001;\n\n    float3 color = float3(0, 0, 0);\n    for (int k = 0; k < 5; k++) {\n        float phase = float(k) * 1.2566;\n        float2 center = float2(0.5 + 0.3 * cos(t + phase), 0.5 + 0.3 * sin(t * 0.7 + phase));\n        float dist = length(uv - center);\n        float glow = 0.02 / (dist * dist + 0.01);\n        float3 c;\n        c.r = glow * (0.5 + 0.5 * sin(phase));\n        c.g = glow * (0.5 + 0.5 * sin(phase + 2.094));\n        c.b = glow * (0.5 + 0.5 * sin(phase + 4.189));\n        color += c;\n    }\n    return float4(color * 0.15, 1.0);\n}\n"
        }
    ]
}
