{
    "formatVersion": 1,
    "hostUniformCatalogVersion": 1,
    "name": "Effects / Plasma",
    "pipelineKind": "raster",
    "language": "hlsl",
    "stages": [
        {
            "stage": "vertex",
            "entryPoint": "VSMain",
            "source": "struct VSOut {\n    float4 pos : SV_POSITION;\n    [[vk::location(0)]] float2 uv : TEXCOORD0;\n};\n\nVSOut VSMain(uint vid : SV_VertexID)\n{\n    VSOut o;\n    o.uv = float2((vid << 1) & 2, vid & 2);\n    o.pos = float4(o.uv * 2.0f - 1.0f, 0.0f, 1.0f);\n    o.uv.y = 1.0f - o.uv.y;\n    return o;\n}"
        },
        {
            "stage": "fragment",
            "entryPoint": "PSMain",
            "source": "cbuffer Host : register(b0)\n{\n    float time_sim_ms;\n    float time_wall_ms;\n    float delta_time_ms;\n    uint  frame_index;\n    float resolution_x;\n    float resolution_y;\n    float mouse_x;\n    float mouse_y;\n    uint  mouse_buttons;\n    float scroll_delta_x;\n    float scroll_delta_y;\n    float drag_accum_x;\n    float drag_accum_y;\n    float scroll_accum_x;\n    float scroll_accum_y;\n    float pan_accum_x;\n    float pan_accum_y;\n};\n\nstruct VSOut {\n    float4 pos : SV_POSITION;\n    [[vk::location(0)]] float2 uv : TEXCOORD0;\n};\n\nfloat4 PSMain(VSOut i) : SV_Target\n{\n    float t = time_sim_ms * 0.001;\n    float2 uv = i.uv * 8.0;\n    float v = sin(uv.x + t);\n    v += sin(uv.y + t * 0.7);\n    v += sin((uv.x + uv.y) + t * 0.5);\n    v += sin(length(uv - float2(4.0, 4.0)) + t * 1.3);\n    v *= 0.25;\n    float3 col;\n    col.r = 0.5 + 0.5 * sin(3.14159 * v);\n    col.g = 0.5 + 0.5 * sin(3.14159 * v + 2.094);\n    col.b = 0.5 + 0.5 * sin(3.14159 * v + 4.188);\n    return float4(col, 1.0);\n}"
        }
    ]
}
