{
    "formatVersion": 1,
    "hostUniformCatalogVersion": 1,
    "name": "Effects / Fire",
    "pipelineKind": "raster",
    "language": "hlsl",
    "stages": [
        {
            "stage": "vertex",
            "entryPoint": "VSMain",
            "source": "struct VSOut {\n    float4 pos : SV_POSITION;\n    [[vk::location(0)]] float2 uv : TEXCOORD0;\n};\n\nVSOut VSMain(uint vid : SV_VertexID)\n{\n    VSOut o;\n    o.uv = float2((vid << 1) & 2, vid & 2);\n    o.pos = float4(o.uv * 2.0f - 1.0f, 0.0f, 1.0f);\n    o.uv.y = 1.0f - o.uv.y;\n    return o;\n}"
        },
        {
            "stage": "fragment",
            "entryPoint": "PSMain",
            "source": "cbuffer Host : register(b0)\n{\n    float time_sim_ms;\n    float time_wall_ms;\n    float delta_time_ms;\n    uint  frame_index;\n    float resolution_x;\n    float resolution_y;\n    float mouse_x;\n    float mouse_y;\n    uint  mouse_buttons;\n    float scroll_delta_x;\n    float scroll_delta_y;\n    float drag_accum_x;\n    float drag_accum_y;\n    float scroll_accum_x;\n    float scroll_accum_y;\n    float pan_accum_x;\n    float pan_accum_y;\n};\n\nstruct VSOut {\n    float4 pos : SV_POSITION;\n    [[vk::location(0)]] float2 uv : TEXCOORD0;\n};\n\nfloat hash(float2 p)\n{\n    return frac(sin(dot(p, float2(127.1, 311.7))) * 43758.5453);\n}\n\nfloat noise(float2 p)\n{\n    float2 i = floor(p);\n    float2 f = frac(p);\n    f = f * f * (3.0 - 2.0 * f);\n    float a = hash(i);\n    float b = hash(i + float2(1, 0));\n    float c = hash(i + float2(0, 1));\n    float d = hash(i + float2(1, 1));\n    return lerp(lerp(a, b, f.x), lerp(c, d, f.x), f.y);\n}\n\nfloat fbm(float2 p)\n{\n    float v = 0.0;\n    float a = 0.5;\n    float2 shift = float2(100.0, 100.0);\n    for (int i = 0; i < 5; i++) {\n        v += a * noise(p);\n        p = p * 2.0 + shift;\n        a *= 0.5;\n    }\n    return v;\n}\n\nfloat4 PSMain(VSOut i) : SV_Target\n{\n    float2 uv = i.uv;\n    float t = time_sim_ms * 0.001;\n    float2 p = uv * float2(4.0, 8.0);\n    p.y -= t * 3.0;\n    float n = fbm(p);\n    n += fbm(p * 2.0 + float2(t * 0.5, 0.0)) * 0.5;\n    float fire = smoothstep(0.1, 0.9, n - (1.0 - uv.y) * 0.8);\n    float3 col = lerp(float3(0.1, 0.0, 0.0), float3(1.0, 0.3, 0.0), fire);\n    col = lerp(col, float3(1.0, 0.9, 0.2), fire * fire);\n    col *= smoothstep(0.0, 0.3, uv.y);\n    return float4(col, 1.0);\n}"
        }
    ]
}
