{
    "formatVersion": 1,
    "hostUniformCatalogVersion": 1,
    "name": "Post-processing / CRT",
    "pipelineKind": "raster",
    "language": "hlsl",
    "stages": [
        {
            "stage": "vertex",
            "entryPoint": "VSMain",
            "source": "struct VSOut {\n    float4 pos : SV_POSITION;\n    [[vk::location(0)]] float2 uv : TEXCOORD0;\n};\n\nVSOut VSMain(uint vid : SV_VertexID)\n{\n    VSOut o;\n    o.uv = float2((vid << 1) & 2, vid & 2);\n    o.pos = float4(o.uv * 2.0f - 1.0f, 0.0f, 1.0f);\n    o.uv.y = 1.0f - o.uv.y;\n    return o;\n}"
        },
        {
            "stage": "fragment",
            "entryPoint": "PSMain",
            "source": "cbuffer Host : register(b0)\n{\n    float time_sim_ms;\n    float time_wall_ms;\n    float delta_time_ms;\n    uint  frame_index;\n    float resolution_x;\n    float resolution_y;\n    float mouse_x;\n    float mouse_y;\n    uint  mouse_buttons;\n    float scroll_delta_x;\n    float scroll_delta_y;\n    float drag_accum_x;\n    float drag_accum_y;\n    float scroll_accum_x;\n    float scroll_accum_y;\n    float pan_accum_x;\n    float pan_accum_y;\n};\n\nstruct VSOut {\n    float4 pos : SV_POSITION;\n    [[vk::location(0)]] float2 uv : TEXCOORD0;\n};\n\nfloat3 scene(float2 uv, float t)\n{\n    float3 col = float3(0.0f, 0.0f, 0.0f);\n    col.r = 0.5f + 0.5f * sin(uv.x * 6.28f + t);\n    col.g = 0.5f + 0.5f * cos(uv.y * 4.0f + t * 0.7f);\n    col.b = 0.5f + 0.5f * sin((uv.x + uv.y) * 3.14f + t * 1.3f);\n    float checker = step(0.5f, frac(uv.x * 8.0f)) * step(0.5f, frac(uv.y * 6.0f));\n    col = lerp(col, col * 1.3f, checker * 0.3f);\n    return col;\n}\n\nfloat2 barrelDistort(float2 uv, float amt)\n{\n    float2 cc = uv - 0.5f;\n    float dist = dot(cc, cc);\n    return uv + cc * dist * amt;\n}\n\nfloat4 PSMain(VSOut i) : SV_Target\n{\n    float t = time_sim_ms * 0.001f;\n    float2 uv = i.uv;\n    uv = barrelDistort(uv, 0.2f);\n    if (uv.x < 0.0f || uv.x > 1.0f || uv.y < 0.0f || uv.y > 1.0f)\n        return float4(0.0f, 0.0f, 0.0f, 1.0f);\n    float2 uvR = barrelDistort(i.uv, 0.22f);\n    float2 uvB = barrelDistort(i.uv, 0.18f);\n    float r = scene(uvR, t).r;\n    float g = scene(uv, t).g;\n    float b = scene(uvB, t).b;\n    float3 col = float3(r, g, b);\n    float scanline = 0.85f + 0.15f * sin(uv.y * resolution_y * 3.14159f);\n    col *= scanline;\n    float2 cc = uv - 0.5f;\n    float vignette = 1.0f - dot(cc, cc) * 1.5f;\n    vignette = saturate(vignette);\n    col *= vignette;\n    col *= 1.0f + 0.02f * sin(t * 60.0f);\n    return float4(col, 1.0f);\n}"
        }
    ]
}
