{
    "formatVersion": 1,
    "hostUniformCatalogVersion": 1,
    "name": "Effects / Starfield",
    "pipelineKind": "raster",
    "language": "hlsl",
    "stages": [
        {
            "stage": "vertex",
            "entryPoint": "VSMain",
            "source": "struct VSOut {\n    float4 pos : SV_POSITION;\n    [[vk::location(0)]] float2 uv : TEXCOORD0;\n};\n\nVSOut VSMain(uint vid : SV_VertexID)\n{\n    VSOut o;\n    o.uv = float2((vid << 1) & 2, vid & 2);\n    o.pos = float4(o.uv * 2.0f - 1.0f, 0.0f, 1.0f);\n    o.uv.y = 1.0f - o.uv.y;\n    return o;\n}"
        },
        {
            "stage": "fragment",
            "entryPoint": "PSMain",
            "source": "cbuffer Host : register(b0)\n{\n    float time_sim_ms;\n    float time_wall_ms;\n    float delta_time_ms;\n    uint  frame_index;\n    float resolution_x;\n    float resolution_y;\n    float mouse_x;\n    float mouse_y;\n    uint  mouse_buttons;\n    float scroll_delta_x;\n    float scroll_delta_y;\n    float drag_accum_x;\n    float drag_accum_y;\n    float scroll_accum_x;\n    float scroll_accum_y;\n    float pan_accum_x;\n    float pan_accum_y;\n};\n\nstruct VSOut {\n    float4 pos : SV_POSITION;\n    [[vk::location(0)]] float2 uv : TEXCOORD0;\n};\n\nfloat hash21(float2 p)\n{\n    p = frac(p * float2(123.34, 456.21));\n    p += dot(p, p + 45.32);\n    return frac(p.x * p.y);\n}\n\nfloat star(float2 uv, float2 center, float brightness)\n{\n    float d = length(uv - center);\n    return brightness / (d * d * 800.0 + 1.0);\n}\n\nfloat4 PSMain(VSOut i) : SV_Target\n{\n    float t = time_sim_ms * 0.001;\n    float3 col = float3(0.0, 0.0, 0.02);\n    for (int layer = 0; layer < 4; layer++) {\n        float speed = 0.2 + layer * 0.15;\n        float scale = 8.0 + layer * 4.0;\n        float2 uv = i.uv * scale;\n        uv.y += t * speed;\n        float2 gv = frac(uv) - 0.5;\n        float2 id = floor(uv);\n        for (int y = -1; y <= 1; y++) {\n            for (int x = -1; x <= 1; x++) {\n                float2 offs = float2(x, y);\n                float2 cid = id + offs;\n                float h = hash21(cid);\n                float2 spos = offs - 0.5 + float2(h, frac(h * 34.56)) * 0.8;\n                float brightness = 0.3 + 0.7 * frac(h * 12.34);\n                float twinkle = 0.7 + 0.3 * sin(t * (2.0 + h * 4.0) + h * 6.28);\n                col += star(gv, spos, brightness * twinkle * (0.2 + layer * 0.1));\n            }\n        }\n    }\n    return float4(col, 1.0);\n}"
        }
    ]
}
