{
    "formatVersion": 1,
    "hostUniformCatalogVersion": 1,
    "name": "Effects / Aurora",
    "pipelineKind": "raster",
    "language": "hlsl",
    "stages": [
        {
            "stage": "vertex",
            "entryPoint": "VSMain",
            "source": "struct VSOut {\n    float4 pos : SV_POSITION;\n    [[vk::location(0)]] float2 uv : TEXCOORD0;\n};\n\nVSOut VSMain(uint vid : SV_VertexID)\n{\n    VSOut o;\n    o.uv = float2((vid << 1) & 2, vid & 2);\n    o.pos = float4(o.uv * 2.0f - 1.0f, 0.0f, 1.0f);\n    o.uv.y = 1.0f - o.uv.y;\n    return o;\n}"
        },
        {
            "stage": "fragment",
            "entryPoint": "PSMain",
            "source": "cbuffer Host : register(b0)\n{\n    float time_sim_ms;\n    float time_wall_ms;\n    float delta_time_ms;\n    uint  frame_index;\n    float resolution_x;\n    float resolution_y;\n    float mouse_x;\n    float mouse_y;\n    uint  mouse_buttons;\n    float scroll_delta_x;\n    float scroll_delta_y;\n    float drag_accum_x;\n    float drag_accum_y;\n    float scroll_accum_x;\n    float scroll_accum_y;\n    float pan_accum_x;\n    float pan_accum_y;\n};\n\nstruct VSOut {\n    float4 pos : SV_POSITION;\n    [[vk::location(0)]] float2 uv : TEXCOORD0;\n};\n\nfloat hash(float n) { return frac(sin(n) * 43758.5453); }\n\nfloat noise(float2 p)\n{\n    float2 i = floor(p);\n    float2 f = frac(p);\n    f = f * f * (3.0 - 2.0 * f);\n    float n = i.x + i.y * 57.0;\n    return lerp(lerp(hash(n), hash(n + 1.0), f.x),\n                lerp(hash(n + 57.0), hash(n + 58.0), f.x), f.y);\n}\n\nfloat4 PSMain(VSOut i) : SV_Target\n{\n    float t = time_sim_ms * 0.001;\n    float2 uv = i.uv;\n    float3 sky = lerp(float3(0.0, 0.0, 0.05), float3(0.0, 0.02, 0.1), uv.y);\n    float aurora = 0.0;\n    for (int k = 0; k < 5; k++) {\n        float freq = 2.0 + k * 0.7;\n        float speed = 0.3 + k * 0.1;\n        float wave = sin(uv.x * freq + t * speed + k * 1.5);\n        wave += noise(float2(uv.x * 3.0 + t * 0.2, k * 10.0)) * 0.5;\n        float band = smoothstep(0.0, 0.1, 0.1 - abs(uv.y - (0.5 + wave * 0.12)));\n        aurora += band * (0.4 + 0.6 * noise(float2(uv.x * 5.0 + t, k * 7.0)));\n    }\n    aurora *= smoothstep(0.2, 0.6, uv.y) * smoothstep(1.0, 0.7, uv.y);\n    float3 green = float3(0.1, 0.8, 0.3);\n    float3 blue = float3(0.2, 0.3, 0.9);\n    float3 auroraCol = lerp(green, blue, uv.y * 1.5);\n    float3 col = sky + auroraCol * aurora * 0.8;\n    return float4(col, 1.0);\n}"
        }
    ]
}
